ATA device, with non-removable media
	Model Number:       HGST HTS725050A7E630                    
	Serial Number:      TF655AY918DEZL
	Firmware Revision:  GH2ZB550
	Transport:          Serial, ATA8-AST, SATA 1.0a, SATA II Extensions, SATA Rev 2.5, SATA Rev 2.6; 

Revision: ATA8-AST T13 Project D1697 Revision 0b

Configuration:
	Logical		max	current
	cylinders	16383	65535
	heads		16	1
	sectors/track	63	63
	--
	CHS current addressable sectors:    4128705
	LBA    user addressable sectors:  268435455
	LBA48  user addressable sectors:  976773168
	Logical  Sector size:                   512 bytes
	Physical Sector size:                  4096 bytes
	Logical Sector-0 offset:                  0 bytes
	device size with M = 1024*1024:      476940 MBytes
	device size with M = 1000*1000:      500107 MBytes (500 GB)
	cache/buffer size  = unknown
	Form Factor: 2.5 inch
	Nominal Media Rotation Rate: 7200

Capabilities:
	LBA, IORDY(can be disabled)
	Queue depth: 32
	Standby timer values: spec'd by Standard, no device specific minimum
	R/W multiple sector transfer: Max = 16	Current = 16
	Advanced power management level: 254
	DMA: mdma0 mdma1 mdma2 udma0 udma1 udma2 udma3 udma4 udma5 *udma6 
	     Cycle time: min=120ns recommended=120ns
	PIO: pio0 pio1 pio2 pio3 pio4 
	     Cycle time: no flow control=120ns  IORDY flow control=120ns

